{
  "$schema":"https://json-schema.org/draft/2020-12/schema",
  "title":"StateLoreFull",
  "type":"object",
  "required":["entity","summary","geographyNotes","societyNotes","economyNotes","adventureHooks","hashOfInputs"],
  "properties":{
    "entity":{"type":"object","required":["type","id"],"properties":{"type":{"const":"state"},"id":{"oneOf":[{"type":"integer"},{"type":"string"}]}}},
    "summary":{"type":"string","maxLength":600},
    "history":{"type":"array","items":{"type":"string"},"maxItems":6},
    "geographyNotes":{"type":"string","maxLength":400},
    "societyNotes":{"type":"string","maxLength":400},
    "economyNotes":{"type":"string","maxLength":400},
    "factions":{"type":"array","items":{"type":"object","properties":{"name":{"type":"string"},"motive":{"type":"string"},"strength":{"type":"string"}}},"maxItems":4},
    "adventureHooks":{"type":"array","items":{"type":"object","required":["title","setup"],"properties":{"title":{"type":"string"},"setup":{"type":"string"},"escalation":{"type":"string"},"reward":{"type":"string"}}},"maxItems":4},
    "dependsOn":{"type":"array","items":{"type":"object","properties":{"type":{"type":"string"},"id":{},"fields":{"type":"array","items":{"type":"string"}}}}},
    "hashOfInputs":{"type":"string"}
  }
}
